{"contractVersion":1,"targetPackage":"gemstone-py-native","status":"Generated PyO3 scaffold and downstream gemstone-py-native expose the Rust-backed native surface; local live smoke and published wheel verification have passed","moduleFunctions":["capabilities_json","samples_json","smoke_dry_run_json","migration_json","compatibility_json","conformance_json","handoff_json"],"nativeSessionMethods":["login_from_env","session_id","eval_repr","eval_json","eval_smallint","eval_oop","execute","resolve","value_to_oop_nil","value_to_oop_bool","value_to_oop_smallint","value_to_oop_char","value_to_oop_string","value_to_oop_symbol","value_to_oop_raw","perform_raw_oop","perform_json","new_string","new_symbol","fetch_string","global_get","global_put_raw","global_put_string","global_put_smallint","add_to_export_set","remove_from_export_set","needs_commit","in_transaction","commit","abort","logout"],"compatibilityMethods":["login_from_env","session_id","eval_repr","eval_value","eval_smallint","eval_oop","execute","resolve","perform_oop","perform_value","new_string","new_symbol","fetch_string","global_get","global_put_oop","global_put_string","global_put_smallint","value_to_oop_nil","value_to_oop_bool","value_to_oop_smallint","value_to_oop_char","value_to_oop_string","value_to_oop_symbol","value_to_oop_raw","add_to_export_set","remove_from_export_set","needs_commit","in_transaction","commit","abort","logout"],"fixtures":[{"path":"examples/py-native/gemstone-rs.py-native.json","command":"gemstone-rs py-native check examples/py-native/gemstone-rs.py-native.json","purpose":"Rust adapter capability contract"},{"path":"examples/py-native/gemstone-rs.py-native-samples.json","command":"gemstone-rs py-native check-samples examples/py-native/gemstone-rs.py-native-samples.json","purpose":"Value and structured error translation samples"},{"path":"examples/py-native/gemstone-rs.py-native-smoke.json","command":"gemstone-rs py-native check-smoke examples/py-native/gemstone-rs.py-native-smoke.json","purpose":"Dependency-free dry-run adapter smoke report"},{"path":"examples/py-native/gemstone-rs.py-native-compat.json","command":"gemstone-rs py-native check-compat examples/py-native/gemstone-rs.py-native-compat.json","purpose":"Python compatibility shim method and return policy"},{"path":"examples/py-native/gemstone-rs.py-native-conformance.json","command":"gemstone-rs py-native check-conformance examples/py-native/gemstone-rs.py-native-conformance.json","purpose":"End-to-end scaffold conformance target for wrapper integration"},{"path":"examples/py-native/gemstone-rs.py-native-handoff.json","command":"gemstone-rs py-native check-handoff examples/py-native/gemstone-rs.py-native-handoff.json","purpose":"Downstream wrapper handoff manifest and acceptance criteria"}],"scaffoldFiles":[{"path":"Cargo.toml","purpose":"Rust package metadata and gemstone-rs dependency"},{"path":"pyproject.toml","purpose":"maturin Python extension metadata"},{"path":"src/lib.rs","purpose":"PyO3 extension module and NativeSession wrapper"},{"path":"src/main.rs","purpose":"Rust-side scaffold smoke executable"},{"path":"PYTHON.md","purpose":"Python build and live smoke instructions"},{"path":"python/gemstone_py_native_compat.py","purpose":"Python package-layer compatibility shim"},{"path":"tests/test_smoke.py","purpose":"pytest smoke tests for module functions, session methods, and compatibility policy"}]}
